ID,review_text
1,The product quality is amazing for the price.
2,"Shipping was delayed by three days, very frustrating."
3,"It works okay, but the battery life could be better."
4,Absolutely terrible customer service. I want a refund.
5,Five stars! Exactly what I was looking for.
6,"The color is slightly different than the picture, but it fits well."
7,Broken right out of the box. Do not buy.
8,Super fast delivery and great packaging.
9,I have mixed feelings about this item.
10,Best purchase I've made all year. Highly recommended.
11,The instruction manual was missing.
12,"Decent value, but feels a bit cheap in hand."
13,Complete waste of money.
14,"I love the design, very sleek and modern."
15,"It does what it says, nothing more, nothing less."
16,"The app keeps crashing, please fix this bug."
17,Exceeded my expectations in every way.
18,Not sure if I would buy this again.
19,Arrived earlier than expected. Thanks!
20,The size chart is completely inaccurate.
21,Functional and affordable.
22,"Horrible experience, nobody replies to emails."
23,It's average. You get what you pay for.
24,Simply fantastic. Will buy one for my friend.
25,The texture is rough and uncomfortable.